date,lineup1,lineup2,lineup3,lineup4,lineup5,lineup6,lineup7,lineup8,lineup9,
2025-02-22, Gunnar Henderson, Cedric Mullins, Jordan Westburg, Ryan O'Hearn, Ryan Mountcastle, Gary Sanchez, Jackson Holliday, Ramon Laureano, Dylan Carlson,
2025-02-23, Terrin Vavra, Colton Cowser, Emmanuel Rivera, Heston Kjerstad, Coby Mayo, Samuel Basallo, Nick Gordon, Vimael Machin, Livan Soto,
2025-02-25, Gunnar Henderson, Adley Rutschman, Cedric Mullins, Ryan O'Hearn, Tyler O'Neill, Heston Kjerstad, Ramon Urias, Ramon Laureano, Jackson Holliday,
2025-02-26, Jackson Holliday, Ryan Mountcastle, Gary Sanchez, Colton Cowser, Coby Mayo, Heston Kjerstad, Dylan Carlson, Emmanuel Rivera, Livan Soto,
2025-02-27, Gunnar Henderson, Adley Rutschman, Cedric Mullins, Tyler O'Neill, Ryan O'Hearn, Ryan Mountcastle, Ramon Laureano, Ramon Urias, Nick Gordon,
2025-02-28, Jackson Holliday, Colton Cowser, Gary Sanchez, Heston Kjerstad, Emmanuel Rivera, Dylan Carlson, Coby Mayo, Daz Cameron, Livan Soto,
2025-03-01, Cedric Mullins, Adley Rutschman, Ryan O'Hearn, Ryan Mountcastle, Ramon Urias, Ramon Laureano, Nick Gordon, Luis Vazquez, Dylan Beavers,
