date,lineup1,lineup2,lineup3,lineup4,lineup5,lineup6,lineup7,lineup8,lineup9,team
2026-03-27, Nick Kurtz, Shea Langeliers, Tyler Soderstrom, Brent Rooker, Jacob Wilson, Lawrence Butler, Max Muncy, Jeff McNeil, Denzel Clarke,ATH
2026-03-28, Nick Kurtz, Shea Langeliers, Tyler Soderstrom, Brent Rooker, Jacob Wilson, Jeff McNeil, Max Muncy, Carlos Cortes, Denzel Clarke,ATH
2026-03-27, Ronald Acuna Jr., Drake Baldwin, Ozzie Albies, Matt Olson, Austin Riley, Eli White, Mauricio Dubon, Jonah Heim, Michael Harris II,ATL
2026-03-28, Ronald Acuna Jr., Drake Baldwin, Matt Olson, Austin Riley, Mike Yastrzemski, Ozzie Albies, Michael Harris II, Dominic Smith, Mauricio Dubon,ATL
2026-03-26, Ketel Marte, Corbin Carroll, Geraldo Perdomo, Gabriel Moreno, Nolan Arenado, Carlos Santana, Jordan Lawlar, Alek Thomas, Tim Tawa,AZ
2026-03-27, Ketel Marte, Corbin Carroll, Geraldo Perdomo, Gabriel Moreno, Pavin Smith, Nolan Arenado, Carlos Santana, Alek Thomas, Jordan Lawlar,AZ
2026-03-28, Ketel Marte, Corbin Carroll, Geraldo Perdomo, Pavin Smith, Nolan Arenado, Alek Thomas, Carlos Santana, James McCann, Jorge Barrosa,AZ
2026-03-26, Taylor Ward, Gunnar Henderson, Pete Alonso, Adley Rutschman, Samuel Basallo, Tyler O'Neill, Colton Cowser, Coby Mayo, Blaze Alexander,BAL
2026-03-28, Taylor Ward, Gunnar Henderson, Pete Alonso, Adley Rutschman, Samuel Basallo, Dylan Beavers, Coby Mayo, Colton Cowser, Jeremiah Jackson,BAL
2026-03-26, Roman Anthony, Trevor Story, Jarren Duran, Willson Contreras, Caleb Durbin, Wilyer Abreu, Isiah Kiner-Falefa, Carlos Narvaez, Ceddanne Rafaela,BOS
2026-03-28, Roman Anthony, Trevor Story, Jarren Duran, Willson Contreras, Wilyer Abreu, Caleb Durbin, Marcelo Mayer, Carlos Narvaez, Ceddanne Rafaela,BOS
2026-03-26, Michael Busch, Alex Bregman, Ian Happ, Pete Crow-Armstrong, Nico Hoerner, Carson Kelly, Moises Ballesteros, Dansby Swanson, Matt Shaw,CHC
2026-03-28, Michael Busch, Alex Bregman, Ian Happ, Pete Crow-Armstrong, Nico Hoerner, Dansby Swanson, Moises Ballesteros, Matt Shaw, Miguel Amaya,CHC
2026-03-26, TJ Friedl, Matt McLain, Elly De La Cruz, Sal Stewart, Eugenio Suarez, Spencer Steer, Tyler Stephenson, Noelvi Marte, Ke'Bryan Hayes,CIN
2026-03-28, TJ Friedl, Matt McLain, Elly De La Cruz, Sal Stewart, Eugenio Suarez, Spencer Steer, Will Benson, Jose Trevino, Ke'Bryan Hayes,CIN
2026-03-26, Steven Kwan, Chase DeLauter, Jose Ramirez, Kyle Manzardo, Bo Naylor, Rhys Hoskins, Daniel Schneemann, Gabriel Arias, Brayan Rocchio,CLE
2026-03-27, Steven Kwan, Chase DeLauter, Jose Ramirez, Kyle Manzardo, Bo Naylor, Rhys Hoskins, CJ Kayfus, Gabriel Arias, Brayan Rocchio,CLE
2026-03-28, Steven Kwan, Chase DeLauter, Jose Ramirez, Kyle Manzardo, David Fry, Daniel Schneemann, Angel Martinez, CJ Kayfus, Brayan Rocchio,CLE
2026-03-27, Jake McCarthy, Hunter Goodman, Willi Castro, Ezequiel Tovar, TJ Rumfield, Jordan Beck, Brenton Doyle, Edouard Julien, Kyle Karros,COL
2026-03-28, Jake McCarthy, Hunter Goodman, Willi Castro, Ezequiel Tovar, TJ Rumfield, Troy Johnston, Brenton Doyle, Kyle Karros, Edouard Julien,COL
2026-03-26, Chase Meidroth, Colson Montgomery, Miguel Vargas, Andrew Benintendi, Austin Hays, Munetaka Murakami, Everson Pereira, Edgar Quero, Luisangel Acuna,CWS
2026-03-28, Chase Meidroth, Colson Montgomery, Andrew Benintendi, Munetaka Murakami, Lenyn Sosa, Tristan Peters, Everson Pereira, Reese McGuire, Luisangel Acuna,CWS
2026-03-26, Kerry Carpenter, Gleyber Torres, Colt Keith, Riley Greene, Spencer Torkelson, Kevin McGonigle, Dillon Dingler, Parker Meadows, Javier Baez,DET
2026-03-27, Kerry Carpenter, Gleyber Torres, Zach McKinstry, Riley Greene, Spencer Torkelson, Kevin McGonigle, Dillon Dingler, Parker Meadows, Javier Baez,DET
2026-03-28, Kerry Carpenter, Gleyber Torres, Colt Keith, Riley Greene, Spencer Torkelson, Kevin McGonigle, Matt Vierling, Zach McKinstry, Jake Rogers,DET
2026-03-26, Jose Altuve, Yordan Alvarez, Isaac Paredes, Carlos Correa, Joey Loperfido, Cam Smith, Christian Walker, Yainer Diaz, Jake Meyers,HOU
2026-03-27, Jeremy Pena, Yordan Alvarez, Isaac Paredes, Jose Altuve, Carlos Correa, Cam Smith, Christian Walker, Yainer Diaz, Brice Matthews,HOU
2026-03-28, Jose Altuve, Yordan Alvarez, Isaac Paredes, Carlos Correa, Christian Walker, Cam Smith, Yainer Diaz, Jake Meyers, Brice Matthews,HOU
2026-03-27, Maikel Garcia, Bobby Witt Jr., Lane Thomas, Salvador Perez, Vinnie Pasquantino, Starling Marte, Jonathan India, Isaac Collins, Carter Jensen,KC
2026-03-28, Maikel Garcia, Bobby Witt Jr., Vinnie Pasquantino, Salvador Perez, Carter Jensen, Jonathan India, Jac Caglianone, Isaac Collins, Kyle Isbel,KC
2026-03-26, Zach Neto, Mike Trout, Nolan Schanuel, Jorge Soler, Yoan Moncada, Jo Adell, Josh Lowe, Logan O'Hoppe, Oswald Peraza,LAA
2026-03-27, Zach Neto, Mike Trout, Nolan Schanuel, Jorge Soler, Yoan Moncada, Jo Adell, Josh Lowe, Logan O'Hoppe, Oswald Peraza,LAA
2026-03-28, Zach Neto, Mike Trout, Nolan Schanuel, Jorge Soler, Yoan Moncada, Jo Adell, Josh Lowe, Logan O'Hoppe, Oswald Peraza,LAA
2026-03-26, Shohei Ohtani, Kyle Tucker, Mookie Betts, Freddie Freeman, Will Smith, Max Muncy, Teoscar Hernandez, Andy Pages, Miguel Rojas,LAD
2026-03-27, Shohei Ohtani, Kyle Tucker, Mookie Betts, Freddie Freeman, Will Smith, Max Muncy, Teoscar Hernandez, Andy Pages, Alex Freeland,LAD
2026-03-28, Shohei Ohtani, Kyle Tucker, Mookie Betts, Will Smith, Freddie Freeman, Teoscar Hernandez, Santiago Espinal, Andy Pages, Miguel Rojas,LAD
2026-03-27, Austin Slater, Agustin Ramirez, Jakob Marsee, Otto Lopez, Connor Norby, Heriberto Hernandez, Xavier Edwards, Owen Caissie, Javier Sanoja,MIA
2026-03-28, Jakob Marsee, Xavier Edwards, Agustin Ramirez, Liam Hicks, Otto Lopez, Owen Caissie, Griffin Conine, Connor Norby, Graham Pauley,MIA
2026-03-26, Brice Turang, William Contreras, Christian Yelich, Andrew Vaughn, Jake Bauers, Sal Frelick, David Hamilton, Garrett Mitchell, Joey Ortiz,MIL
2026-03-28, Brice Turang, William Contreras, Christian Yelich, Jake Bauers, Garrett Mitchell, Sal Frelick, Joey Ortiz, David Hamilton, Brandon Lockridge,MIL
2026-03-26, Austin Martin, Byron Buxton, Luke Keaschall, Ryan Jeffers, Matt Wallner, Josh Bell, Victor Caratini, Royce Lewis, Brooks Lee,MIN
2026-03-28, Kody Clemens, Byron Buxton, Luke Keaschall, Matt Wallner, Josh Bell, Ryan Jeffers, Trevor Larnach, Royce Lewis, Brooks Lee,MIN
2026-03-26, Francisco Lindor, Juan Soto, Bo Bichette, Jorge Polanco, Luis Robert Jr., Brett Baty, Marcus Semien, Carson Benge, Francisco Alvarez,NYM
2026-03-28, Francisco Lindor, Juan Soto, Bo Bichette, Jorge Polanco, Luis Robert Jr., Brett Baty, Marcus Semien, Carson Benge, Francisco Alvarez,NYM
2026-03-25, Trent Grisham, Aaron Judge, Cody Bellinger, Ben Rice, Giancarlo Stanton, Jazz Chisholm Jr., Jose Caballero, Ryan McMahon, Austin Wells,NYY
2026-03-27, Paul Goldschmidt, Aaron Judge, Cody Bellinger, Giancarlo Stanton, Amed Rosario, Jazz Chisholm Jr., Jose Caballero, Randal Grichuk, Austin Wells,NYY
2026-03-28, Trent Grisham, Aaron Judge, Cody Bellinger, Ben Rice, Giancarlo Stanton, Jazz Chisholm Jr., Jose Caballero, Ryan McMahon, Austin Wells,NYY
2026-03-26, Trea Turner, Kyle Schwarber, Bryce Harper, Alec Bohm, Bryson Stott, Adolis Garcia, Brandon Marsh, J.T. Realmuto, Justin Crawford,PHI
2026-03-28, Trea Turner, Kyle Schwarber, Bryce Harper, Alec Bohm, Bryson Stott, Adolis Garcia, Brandon Marsh, J.T. Realmuto, Justin Crawford,PHI
2026-03-26, Oneil Cruz, Brandon Lowe, Bryan Reynolds, Marcell Ozuna, Ryan O'Hearn, Jared Triolo, Spencer Horwitz, Nick Gonzales, Henry Davis,PIT
2026-03-28, Jared Triolo, Ryan O'Hearn, Bryan Reynolds, Marcell Ozuna, Nick Gonzales, Brandon Lowe, Nick Yorke, Joey Bart, Jake Mangum,PIT
2026-03-26, Fernando Tatis Jr., Xander Bogaerts, Manny Machado, Jackson Merrill, Miguel Andujar, Gavin Sheets, Ramon Laureano, Freddy Fermin, Jake Cronenworth,SD
2026-03-27, Fernando Tatis Jr., Xander Bogaerts, Manny Machado, Jackson Merrill, Miguel Andujar, Ramon Laureano, Ty France, Jake Cronenworth, Luis Campusano,SD
2026-03-28, Jake Cronenworth, Fernando Tatis Jr., Manny Machado, Jackson Merrill, Xander Bogaerts, Gavin Sheets, Ramon Laureano, Nick Castellanos, Freddy Fermin,SD
2026-03-26, Brendan Donovan, Cal Raleigh, Julio Rodriguez, Josh Naylor, Randy Arozarena, Luke Raley, Dominic Canzone, Cole Young, Leo Rivas,SEA
2026-03-27, Brendan Donovan, Cal Raleigh, Julio Rodriguez, Josh Naylor, Randy Arozarena, Luke Raley, Dominic Canzone, Cole Young, Leo Rivas,SEA
2026-03-28, Rob Refsnyder, Cal Raleigh, Julio Rodriguez, Josh Naylor, Randy Arozarena, Brendan Donovan, Victor Robles, Leo Rivas, Cole Young,SEA
2026-03-25, Luis Arraez, Matt Chapman, Rafael Devers, Willy Adames, Jung Hoo Lee, Heliot Ramos, Casey Schmitt, Patrick Bailey, Harrison Bader,SF
2026-03-27, Luis Arraez, Matt Chapman, Rafael Devers, Willy Adames, Jung Hoo Lee, Heliot Ramos, Casey Schmitt, Patrick Bailey, Harrison Bader,SF
2026-03-28, Jung Hoo Lee, Matt Chapman, Luis Arraez, Rafael Devers, Heliot Ramos, Willy Adames, Harrison Bader, Patrick Bailey, Casey Schmitt,SF
2026-03-26, JJ Wetherholt, Ivan Herrera, Alec Burleson, Masyn Winn, Nolan Gorman, Jordan Walker, Nathan Church, Pedro Pages, Victor Scott II,STL
2026-03-28, JJ Wetherholt, Ivan Herrera, Alec Burleson, Masyn Winn, Nolan Gorman, Ramon Urias, Nathan Church, Jordan Walker, Victor Scott II,STL
2026-03-26, Yandy Diaz, Ryan Vilade, Jonathan Aranda, Junior Caminero, Ben Williamson, Jonny DeLuca, Nick Fortes, Cedric Mullins, Carson Williams,TB
2026-03-28, Yandy Diaz, Jonathan Aranda, Jake Fraley, Junior Caminero, Cedric Mullins, Chandler Simpson, Carson Williams, Richie Palacios, Hunter Feduccia,TB
2026-03-26, Brandon Nimmo, Wyatt Langford, Corey Seager, Jake Burger, Andrew McCutchen, Josh Jung, Josh Smith, Danny Jansen, Sam Haggerty,TEX
2026-03-28, Brandon Nimmo, Wyatt Langford, Corey Seager, Jake Burger, Joc Pederson, Josh Smith, Josh Jung, Evan Carter, Danny Jansen,TEX
2026-03-27, George Springer, Nathan Lukes, Vladimir Guerrero Jr., Addison Barger, Alejandro Kirk, Daulton Varsho, Kazuma Okamoto, Ernie Clement, Andres Gimenez,TOR
2026-03-28, George Springer, Davis Schneider, Vladimir Guerrero Jr., Kazuma Okamoto, Alejandro Kirk, Daulton Varsho, Ernie Clement, Myles Straw, Andres Gimenez,TOR
2026-03-26, James Wood, Andres Chaparro, Brady House, Daylen Lile, Joey Wiemer, CJ Abrams, Nasim Nunez, Keibert Ruiz, Jacob Young,WSH
2026-03-28, James Wood, Drew Millas, Luis Garcia Jr., Daylen Lile, Brady House, Jorbit Vivas, Nasim Nunez, Jose Tena, Jacob Young,WSH
