date,lineup1,lineup2,lineup3,lineup4,lineup5,lineup6,lineup7,lineup8,lineup9,
2026-03-26, Kerry Carpenter, Gleyber Torres, Colt Keith, Riley Greene, Spencer Torkelson, Kevin McGonigle, Dillon Dingler, Parker Meadows, Javier Baez,
2026-03-27, Kerry Carpenter, Gleyber Torres, Zach McKinstry, Riley Greene, Spencer Torkelson, Kevin McGonigle, Dillon Dingler, Parker Meadows, Javier Baez,
2026-03-28, Kerry Carpenter, Gleyber Torres, Colt Keith, Riley Greene, Spencer Torkelson, Kevin McGonigle, Matt Vierling, Zach McKinstry, Jake Rogers,
2026-03-30, Kerry Carpenter, Gleyber Torres, Colt Keith, Riley Greene, Spencer Torkelson, Kevin McGonigle, Dillon Dingler, Parker Meadows, Javier Baez,
2026-03-31, Colt Keith, Kevin McGonigle, Gleyber Torres, Riley Greene, Kerry Carpenter, Spencer Torkelson, Zach McKinstry, Parker Meadows, Jake Rogers,
