date,lineup1,lineup2,lineup3,lineup4,lineup5,lineup6,lineup7,lineup8,lineup9,
2025-03-27, Tommy Pham, Bryan Reynolds, Oneil Cruz, Joey Bart, Andrew McCutchen, Nick Gonzales, Endy Rodriguez, Ke'Bryan Hayes, Isiah Kiner-Falefa,
2025-03-28, Tommy Pham, Bryan Reynolds, Oneil Cruz, Joey Bart, Andrew McCutchen, Ke'Bryan Hayes, Endy Rodriguez, Adam Frazier, Isiah Kiner-Falefa,
2025-03-29, Ji Hwan Bae, Bryan Reynolds, Oneil Cruz, Joey Bart, Jack Suwinski, Ke'Bryan Hayes, Jared Triolo, Adam Frazier, Isiah Kiner-Falefa,
2025-03-30, Adam Frazier, Bryan Reynolds, Tommy Pham, Andrew McCutchen, Jack Suwinski, Endy Rodriguez, Jared Triolo, Enmanuel Valdez, Isiah Kiner-Falefa,
2025-03-31, Tommy Pham, Bryan Reynolds, Oneil Cruz, Joey Bart, Jack Suwinski, Ke'Bryan Hayes, Endy Rodriguez, Adam Frazier, Isiah Kiner-Falefa,
