date,lineup1,lineup2,lineup3,lineup4,lineup5,lineup6,lineup7,lineup8,lineup9,
2026-02-21, Jorge Mateo, Mike Yastrzemski, Eli White, Jonah Heim, Ben Gamel, Kyle Farmer, Brett Wisely, Tristin English, Luke Williams,
2026-02-22, Ronald Acuna Jr., Drake Baldwin, Matt Olson, Jurickson Profar, Austin Riley, Ozzie Albies, Michael Harris II, Aaron Schunk, Mauricio Dubon,
2026-02-23, Jorge Mateo, Dominic Smith, Eli White, Ben Gamel, Nacho Alvarez Jr., DaShawn Keirsey Jr., Brewer Hicklen, Aaron Schunk, Chadwick Tromp,
2026-02-24, Ronald Acuna Jr., Jurickson Profar, Matt Olson, Austin Riley, Ozzie Albies, Mike Yastrzemski, Michael Harris II, Jonah Heim, Mauricio Dubon,
2026-02-25, Ronald Acuna Jr., Drake Baldwin, Matt Olson, Jurickson Profar, Austin Riley, Mike Yastrzemski, Ozzie Albies, Michael Harris II, Mauricio Dubon,
2026-02-26, Brett Wisely, Nacho Alvarez Jr., Dominic Smith, Ben Gamel, Kyle Farmer, DaShawn Keirsey Jr., Chadwick Tromp, Luke Williams, Jose Azocar,
