date,lineup1,lineup2,lineup3,lineup4,lineup5,lineup6,lineup7,lineup8,lineup9,
2026-02-21, Shohei Ohtani, Teoscar Hernandez, Andy Pages, Dalton Rushing, Santiago Espinal, Hyeseong Kim, Alex Freeland, Ryan Ward, Zach Ehrhard,
2026-02-22, Miguel Rojas, Kyle Tucker, Will Smith, Ryan Ward, Nick Senzel, James Tibbs III, Zach Ehrhard, Ryan Fitzgerald, Michael Siani,
2026-02-23, Hyeseong Kim, Teoscar Hernandez, Andy Pages, Dalton Rushing, Santiago Espinal, Alex Freeland, Keston Hiura, Zach Ehrhard, James Tibbs III,
2026-02-24, Miguel Rojas, Kyle Tucker, Will Smith, Freddie Freeman, Teoscar Hernandez, Andy Pages, Alex Freeland, Nick Senzel, Keston Hiura,
2026-02-25, Hyeseong Kim, Santiago Espinal, Dalton Rushing, Alex Freeland, Ryan Ward, Nick Senzel, James Tibbs III, Zach Ehrhard, Noah Miller,
