date,lineup1,lineup2,lineup3,lineup4,lineup5,lineup6,lineup7,lineup8,lineup9,
2026-02-21, Justin Crawford, Adolis Garcia, Edmundo Sosa, Otto Kemp, Bryan De La Cruz, Rafael Marchan, Dylan Moore, Christian Cairo, Keaton Anthony,
2026-02-22, Trea Turner, Kyle Schwarber, Bryce Harper, Alec Bohm, Brandon Marsh, J.T. Realmuto, Bryson Stott, Bryan De La Cruz, Johan Rojas,
2026-02-23, Justin Crawford, Adolis Garcia, Edmundo Sosa, Otto Kemp, Garrett Stubbs, Rafael Marchan, Liover Peguero, Christian Cairo, Bryan Rincon,
2026-02-24, Trea Turner, Bryson Stott, Bryan De La Cruz, Johan Rojas, Rafael Marchan, Garrett Stubbs, Dylan Moore, Aroon Escobar, Felix Reyes,
2026-02-25, Kyle Schwarber, J.T. Realmuto, Bryce Harper, Alec Bohm, Adolis Garcia, Justin Crawford, Otto Kemp, Edmundo Sosa, Pedro Leon,
